{
  "$schema": "https://json-schema.org/draft/2020-12/schema",
  "$id": "https://meta-skills-library.dev/schemas/progress_evidence.schema.json",
  "title": "Loop Progress Evidence v2",
  "type": "object",
  "required": [
    "schema_version", "evidence_type", "run_id", "cycle_id", "iteration",
    "cycle_iteration", "observed_at", "measurement_source", "token_count_quality",
    "elapsed_runtime_seconds", "cumulative_token_count", "artifact_hash",
    "diff_fingerprint", "test_count", "new_evidence_count"
  ],
  "properties": {
    "schema_version": { "const": "2.0.0" },
    "evidence_type": { "const": "progress_sample" },
    "run_id": { "type": "string", "minLength": 1 },
    "cycle_id": { "type": "string", "minLength": 1 },
    "iteration": { "type": "integer", "minimum": 1 },
    "cycle_iteration": { "type": "integer", "minimum": 1 },
    "observed_at": { "type": "string", "format": "date-time" },
    "measurement_source": { "enum": ["host_api", "controller_counter"] },
    "token_count_quality": { "const": "authoritative" },
    "elapsed_runtime_seconds": { "type": "integer", "minimum": 0 },
    "cumulative_token_count": { "type": "integer", "minimum": 0 },
    "artifact_hash": { "type": "string", "pattern": "^sha256:[0-9a-f]{64}$" },
    "diff_fingerprint": { "type": "string", "pattern": "^sha256:[0-9a-f]{64}$" },
    "test_count": { "type": "integer", "minimum": 0 },
    "new_evidence_count": { "type": "integer", "minimum": 0 }
  },
  "additionalProperties": false
}
