{
  "schema_version": "2.0.0",
  "evidence_type": "progress_sample",
  "run_id": "example-run-001",
  "cycle_id": "bounded_plan_execute_cycle",
  "iteration": 2,
  "cycle_iteration": 2,
  "observed_at": "2026-07-10T12:02:20Z",
  "measurement_source": "controller_counter",
  "token_count_quality": "authoritative",
  "elapsed_runtime_seconds": 260,
  "cumulative_token_count": 18000,
  "artifact_hash": "sha256:cccccccccccccccccccccccccccccccccccccccccccccccccccccccccccccccc",
  "diff_fingerprint": "sha256:dddddddddddddddddddddddddddddddddddddddddddddddddddddddddddddddd",
  "test_count": 1,
  "new_evidence_count": 1
}
